{
  "$schema": "./schema.json",
  "name": "IPV4",
  "description": "Write a Regex that matches an IPV4 address. You must capture the segments and make sure that the range is correct.",
  "difficulty": 3,
  "category": "Web",
  "tests": {
    "shouldMatch": [
      {
        "value": "127.0.0.1",
        "match": ["127", "0", "0", "1"]
      },
      {
        "value": "10.1.0.1",
        "match": ["10", "1", "0", "1"]
      },
      {
        "value": "192.168.35.155",
        "match": ["192", "168", "35", "155"]
      },
      {
        "value": "0.0.0.0",
        "match": ["0", "0", "0", "0"]
      },
      {
        "value": "255.255.255.255",
        "match": ["255", "255", "255", "255"]
      }
    ],
    "shouldNotMatch": [
      {
        "value": "192.168.155"
      },
      {
        "value": "192.35.155.12."
      },
      {
        "value": "1.1.155."
      },
      {
        "value": "192.168.155.58.12"
      },
      {
        "value": "1921.155.58.12"
      },
      {
        "value": "192.155.5878.12"
      },
      {
        "value": "192155587812"
      },
      {
        "value": "350.2.10.8"
      },
      {
        "value": "89.648.11.15"
      },
      {
        "value": "89.158.256.125"
      }
    ]
  }
}
