{
  "$schema": "./schema.json",
  "name": "IPV4 - Easy",
  "description": "Internet Protocol version 4 (IPv4) is the fourth version of the Internet Protocol (IP). It is one of the core protocols of standards-based internetworking methods in the Internet and other packet-switched networks.",
  "difficulty": 2,
  "category": "Web",
  "tests": {
    "shouldMatch": [
      {
        "value": "127.0.0.1",
        "match": []
      },
      {
        "value": "10.1.0.1",
        "match": []
      },
      {
        "value": "192.168.35.155",
        "match": []
      },
      {
        "value": "0.0.0.0",
        "match": []
      }
    ],
    "shouldNotMatch": [
      {
        "value": "192.168.155"
      },
      {
        "value": "192.35.155.12."
      },
      {
        "value": "1.1.155."
      },
      {
        "value": "1921.155.58.12"
      },
      {
        "value": "192.1551.878.12"
      },
      {
        "value": "192.155.5878.12"
      },
      {
        "value": "192.15.78.1211"
      },
      {
        "value": "192155587812"
      }
    ]
  }
}
