{
  "$schema": "./schema.json",
  "name": "Form type - Medium",
  "description": "Form types is how <a href='https://www.sec.gov/forms'>the U.S. SECURITIES AND EXCHANGE COMMISSION</a> label company filing, often the first task of web scraping in natural language processing.",
  "difficulty": 4,
  "category": "Web",
  "tests": {
    "shouldMatch": [
      {
        "value": "ABS-15G",
        "match": [
          "ABS-15G"
        ]
      },
      {
        "value": "X-17A-5",
        "match": [
          "X-17A-5"
        ]
      },
      {
        "value": "24F-2",
        "match": [
          "24F-2"
        ]
      },
      {
        "value": "CFPORTAL",
        "match": [
          "CFPORTAL"
        ]
      },
      {
        "value": "N-17f-2",
        "match": [
          "N-17f-2"
        ]
      }
    ],
    "shouldNotMatch": [
      {
        "value": "ABS-GGEF"
      },
      {
        "value": "ABS D-15E"
      },
      {
        "value": "LKA0f0-F"
      },
      {
        "value": "IJG1-JKA"
      },
      {
        "value": "JEQB1-PB2"
      }
    ]
  }
}
